{
  "$schema": "http://json-schema.org/draft-04/schema#",
  "type": "array",
  "items": {
    "type": "object",
    "properties": {
      "id": {
        "type": "integer"
      },
      "categoryId": {
        "type": "integer"
      },
      "amount": {
        "type": "number"
      },
      "description": {
        "type": "string"
      },
      "createdAt": {
        "type": "string"
      },
      "createdBy": {
        "type": "integer"
      }
    },
    "required": [
      "id",
      "categoryId",
      "amount",
      "description",
      "createdAt",
      "createdBy"
    ]
  }
}
